{
  "schema_version": "resi_edge_manifest_v1",
  "package_contract_id": "resi-edge-canonical-upgrade-package",
  "target": {
    "property_code": "TX4FC",
    "source_property_code": "TX4FC",
    "domain": "townestoneat359.com",
    "property_name": "Townestone at 359",
    "city": "Richmond",
    "state": "TX",
    "community_id": "d41b32d1-9476-4936-9248-cd418f8c86be",
    "ga4_property_id": "507293675",
    "ga4_measurement_id": "G-J582E0V5T5",
    "gsc_property": "sc-domain:townestoneat359.com",
    "canonical_url": "https://townestoneat359.com/",
    "governed_reference_url": "https://townestoneat359.com/"
  },
  "routing": {
    "cloudflare_zone_name": "townestoneat359.com",
    "route_pattern": "townestoneat359.com/*",
    "existing_worker_script": "townestone-native-optimizer",
    "reference_preserve_routes": [
      {
        "pattern": "townestoneat359.com/*",
        "zone_id": "66f08cb069ee5f17428f08bee888d176"
      }
    ],
    "mutation_policy": "canonical_base_reference_no_live_mutation_without_explicit_approval"
  },
  "mobile_shell": {
    "layout_contract": {
      "source_reference": "Townestone at 359 live mobile shell and analytics reference, verified from active Worker/evidence 08/06/2026 and governed identity 08/12/2026",
      "mobile_only": true,
      "desktop_topper_allowed": false,
      "property_specific_variants_allowed": false,
      "standalone_edge_owned_initial_response_required": true,
      "promo_bar_height_px": 60,
      "header_height_px": 80,
      "full_height_mobile_hero_required": true,
      "native_wordpress_runtime_in_initial_mobile_html_allowed": false,
      "native_dam_image_references_in_initial_mobile_html_allowed": false
    },
    "brand_theme": {
      "source": "Townestone active Worker theme tokens plus Venterra navy shell standard",
      "promo_background": "#15284B",
      "promo_text": "#FFFFFF",
      "promo_surface": "#F6F6F5",
      "promo_panel_text": "#15284B",
      "primary_text": "#15284B",
      "button_background": "#FFFFFF",
      "button_text": "#15284B",
      "drawer_background": "#15284B",
      "drawer_text": "#FFFFFF",
      "hero_background": "#15284B",
      "hero_overlay": "rgba(21,40,75,.34)",
      "body_text": "#15284B",
      "panel_background": "#F6F6F5"
    },
    "fonts": [
      {
        "family": "Poppins",
        "url": "https://townestoneat359.com/wp-content/themes/resi-child-theme/fonts/poppins-581f0b26.woff2",
        "weight": 400,
        "style": "normal"
      },
      {
        "family": "Poppins",
        "url": "https://townestoneat359.com/wp-content/themes/resi-child-theme/fonts/poppins-2b4d4a2f.woff2",
        "weight": 600,
        "style": "normal"
      },
      {
        "family": "Poppins",
        "url": "https://townestoneat359.com/wp-content/themes/resi-child-theme/fonts/poppins-5d280ea4.woff2",
        "weight": 700,
        "style": "normal"
      },
      {
        "family": "Merriweather",
        "url": "https://townestoneat359.com/wp-content/themes/resi-child-theme/fonts/merriweather-8b1e9ec0.woff2",
        "weight": 400,
        "style": "normal"
      },
      {
        "family": "nevisbold",
        "url": "https://townestoneat359.com/wp-content/themes/resi-child-theme/fonts/nevis_3-webfont.woff2",
        "weight": 600,
        "style": "normal"
      }
    ],
    "body_font": "Poppins",
    "heading_font": "Merriweather",
    "title_font": "nevisbold",
    "awards": {
      "present": false,
      "source": "No sourced Townestone mobile-shell award row is recorded in the active Worker evidence; package must not render a placeholder award.",
      "assets": []
    },
    "promo": {
      "present": true,
      "source": "feed_backed_current_offer_from_active_Townestone_worker_and_launch_evidence",
      "title": "Get up to 8 weeks free!",
      "title_case_required": true,
      "body": "Receive an additional $750 if you sign a 15+ month term. Limited time only.",
      "disclaimer": "*Select Homes - Limited Time Offer",
      "primary_cta_label": "See Availability",
      "primary_cta_url": "https://townestoneat359.com/apartments/",
      "secondary_cta_label": "Contact Us",
      "secondary_cta_url": "https://townestoneat359.com/contact/"
    },
    "hero": {
      "image_mobile": "/assets/resi-edge-assets/TX4FC/home/hero-mobile-750x1000.avif",
      "source_image": "https://dam.getresi.co/26106/conversions/Home-Hero-full.jpg",
      "tm_allowed": false,
      "headline": "1 and 2 Bedroom Apartments in Richmond, TX",
      "primary_cta_label": "Find Your Home",
      "primary_cta_url": "https://townestoneat359.com/apartments/",
      "title_text": "Live Better. Live Easy."
    },
    "reviews": {
      "present": false,
      "source": "No sourced Townestone review row is recorded in the active reference Worker descriptor; package must not invent review stars.",
      "last_verified": "08/12/2026",
      "fractional_stars_required": true,
      "full_star_rounding_allowed": false,
      "link_required": false
    },
    "navigation": {
      "tour_url": "https://online.venterraliving.com/eOnlineLease/portal/scheduleTour/TX4FC",
      "apply_url": "https://online.venterraliving.com/eOnlineLease/portal/createPipelineApplication/TX4FC",
      "links": [
        {
          "label": "Apartments & Pricing",
          "url": "https://townestoneat359.com/apartments/"
        },
        {
          "label": "Features",
          "url": "https://townestoneat359.com/features/"
        },
        {
          "label": "Amenities",
          "url": "https://townestoneat359.com/amenities/"
        },
        {
          "label": "Gallery",
          "url": "https://townestoneat359.com/gallery/"
        },
        {
          "label": "Location",
          "url": "https://townestoneat359.com/neighborhood/"
        },
        {
          "label": "FAQs",
          "url": "https://townestoneat359.com/faqs/"
        },
        {
          "label": "Reviews",
          "url": "https://townestoneat359.com/reviews/"
        },
        {
          "label": "Contact",
          "url": "https://townestoneat359.com/contact/"
        },
        {
          "label": "Specials",
          "url": "https://townestoneat359.com/specials/"
        },
        {
          "label": "About Venterra",
          "url": "https://townestoneat359.com/about/"
        },
        {
          "label": "SMARTHUB",
          "url": "https://online.venterraliving.com/smarthub/login"
        }
      ]
    },
    "content_blocks": [
      {
        "sequence": 1,
        "kind": "welcome",
        "heading": "Welcome to Townestone at 359",
        "subheading": "Choose the perfect layout for your lifestyle.",
        "body": "Contemporary comfort meets everyday convenience in Richmond. Our 1 and 2 Bedroom apartment homes are designed to enhance every lifestyle, blending modern living with a welcoming community feel and placing you near shopping, dining, recreation, and major employment destinations throughout Richmond, Sugar Land, and Fort Bend County.",
        "cta_label": "See Available Homes",
        "cta_url": "https://townestoneat359.com/apartments/",
        "image_url": "/assets/resi-edge-assets/TX4FC/home/welcome-640.avif",
        "source_image_url": "https://dam.getresi.co/55957/conversions/Home-Features-web-full.jpg",
        "image_alt": "Apartment kitchen at Townestone at 359"
      },
      {
        "sequence": 2,
        "kind": "features",
        "eyebrow": "Apartment Features",
        "heading": "Stylish Living Spaces",
        "body": "Experience contemporary apartment interiors with modern finishes, natural light, and practical conveniences designed to support everyday living in Richmond.",
        "bullets": [
          "Modern Apartment Interiors",
          "Convenient Home Features",
          "Contemporary Finishes",
          "Richmond Location"
        ],
        "cta_label": "See Features",
        "cta_url": "https://townestoneat359.com/features/",
        "image_url": "/assets/resi-edge-assets/TX4FC/home/features-900.avif",
        "source_image_url": "https://dam.getresi.co/55228/conversions/Home-Amenities-web-full.jpg",
        "image_alt": "Community amenity space at Townestone at 359"
      }
    ],
    "native_continuation": {
      "required_after_edge_shell": true,
      "dedupe_required": true,
      "first_two_blocks_must_not_repeat": true
    }
  },
  "desktop": {
    "mode": "native_passthrough_with_analytics_guards",
    "desktop_topper_allowed": false,
    "native_render_required": true,
    "visual_mutation_allowed_without_explicit_approval": false
  },
  "phone_attribution": {
    "default_source": "VWS",
    "default_display_phone": "(346) 623-1550",
    "office_phone_must_not_be_default": "default display is the VWS attribution phone from the governed source lookup",
    "lookup_trigger": "incoming URL source/id string",
    "source_lookup": [
      {
        "code": "TX4FC30L",
        "source": "VWS",
        "phone": "(346) 623-1550"
      },
      {
        "code": "TX4FCAH",
        "source": "AH",
        "phone": "(346) 623-1550"
      },
      {
        "code": "TX4FCALIST",
        "source": "APL",
        "phone": "(512) 800-7701"
      },
      {
        "code": "TX4FCAPT",
        "source": "ADC-VL",
        "phone": "(512) 800-7701"
      },
      {
        "code": "TX4FCBNG",
        "source": "BNG",
        "phone": "(512) 800-7701"
      },
      {
        "code": "TX4FCGOA",
        "source": "GOA",
        "phone": "(512) 800-7701"
      },
      {
        "code": "TX4FCGOO",
        "source": "GOO-VL",
        "phone": "(512) 800-7701"
      },
      {
        "code": "TX4FCSOC",
        "source": "SOC",
        "phone": "(512) 800-7701"
      },
      {
        "code": "TX4FCYAH",
        "source": "YHO",
        "phone": "(512) 800-7701"
      }
    ]
  },
  "analytics": {
    "owner": "cloudflare_zaraz",
    "ga4": {
      "owner": "cloudflare_zaraz",